Name,Set code,Set name,Collector number,Foil,Rarity,Quantity,ManaBox ID,Scryfall ID,Purchase price,Misprint,Altered,Condition,Language,Purchase price currency,type_line,mana_cost,colors,color_identity,oracle_text,legal_commander,legal_pauper,image_url
Ezio Auditore da Firenze,ACR,Assassin's Creed,25,foil,mythic,1,91739,dae9ee75-30b8-4e24-af8b-031c816d3221,6.65,False,False,near_mint,en,USD,Legendary Creature — Human Assassin,{1}{B},B,"B, G, R, U, W","Menace
Assassin spells you cast have freerunning {B}{B}. (You may cast a spell for its freerunning cost if you dealt combat damage to a player this turn with an Assassin or commander.)
Whenever Ezio deals combat damage to a player, you may pay {W}{U}{B}{R}{G} if that player has 10 or less life. When you do, that player loses the game.",legal,not_legal,https://cards.scryfall.io/normal/front/d/a/dae9ee75-30b8-4e24-af8b-031c816d3221.jpg?1737999942
Fa'adiyah Seer,DMR,Dominaria Remastered,340,foil,common,1,78055,a095eda4-7a9c-4161-a775-4dbfac32dbab,0.25,False,False,near_mint,en,USD,Creature — Human Shaman,{1}{G},G,G,"{T}: Draw a card and reveal it. If it isn't a land card, discard it.",legal,legal,https://cards.scryfall.io/normal/front/a/0/a095eda4-7a9c-4161-a775-4dbfac32dbab.jpg?1675202073
Fabrication Foundry,LCI,The Lost Caverns of Ixalan,354,normal,rare,1,88522,5b5efc5e-1582-4bb7-9ae1-bc4c0487ee94,0.35,False,False,near_mint,en,USD,Artifact,{1}{W},W,W,"{T}: Add {W}. Spend this mana only to cast an artifact spell or activate an ability of an artifact source.
{2}{W}, {T}, Exile one or more other artifacts you control with total mana value X: Return target artifact card with mana value X or less from your graveyard to the battlefield. Activate only as a sorcery.",legal,not_legal,https://cards.scryfall.io/normal/front/5/b/5b5efc5e-1582-4bb7-9ae1-bc4c0487ee94.jpg?1699044938
Faithless Looting,SLD,Secret Lair Drop,1779,normal,rare,1,97244,b069ede2-dec3-43b3-85ce-b9d60a1e96a7,8.79,False,False,near_mint,en,USD,Sorcery,{R},R,R,"Draw two cards, then discard two cards.
Flashback {2}{R} (You may cast this card from your graveyard for its flashback cost. Then exile it.)",legal,legal,https://cards.scryfall.io/normal/front/b/0/b069ede2-dec3-43b3-85ce-b9d60a1e96a7.jpg?1723568925
Fanatic of Rhonas,MH3,Modern Horizons 3,152,normal,rare,1,94369,1f9fb33a-3b39-4aff-93b8-aedafe0ea694,11.49,False,False,near_mint,en,USD,Creature — Snake Druid,{1}{G},G,G,"{T}: Add {G}.
Ferocious — {T}: Add {G}{G}{G}{G}. Activate only if you control a creature with power 4 or greater.
Eternalize {2}{G}{G} ({2}{G}{G}, Exile this card from your graveyard: Create a token that's a copy of it, except it's a 4/4 black Zombie Snake Druid with no mana cost. Eternalize only as a sorcery.)",legal,not_legal,https://cards.scryfall.io/normal/front/1/f/1f9fb33a-3b39-4aff-93b8-aedafe0ea694.jpg?1717012445
Falkenrath Gorger,INR,Innistrad Remastered,152,normal,rare,1,101849,16c376f5-f69b-49d4-95f4-92bdd68c564c,0.25,False,False,near_mint,en,USD,Creature — Vampire Berserker,{R},R,R,"Each Vampire creature card you own that isn't on the battlefield has madness. The madness cost is equal to its mana cost. (If you discard a card with madness, discard it into exile. When you do, cast it for its madness cost or put it into your graveyard.)",legal,not_legal,https://cards.scryfall.io/normal/front/1/6/16c376f5-f69b-49d4-95f4-92bdd68c564c.jpg?1736468131
Fanatic of Rhonas,MH3,Modern Horizons 3,458,foil,rare,1,94828,f82fce56-307a-44bf-8c46-0e1328550e17,13.47,False,False,near_mint,en,USD,Creature — Snake Druid,{1}{G},G,G,"{T}: Add {G}.
Ferocious — {T}: Add {G}{G}{G}{G}. Activate only if you control a creature with power 4 or greater.
Eternalize {2}{G}{G} ({2}{G}{G}, Exile this card from your graveyard: Create a token that's a copy of it, except it's a 4/4 black Zombie Snake Druid with no mana cost. Eternalize only as a sorcery.)",legal,not_legal,https://cards.scryfall.io/normal/front/f/8/f82fce56-307a-44bf-8c46-0e1328550e17.jpg?1717015338
Falkenrath Gorger,INR,Innistrad Remastered,152,foil,rare,1,101849,16c376f5-f69b-49d4-95f4-92bdd68c564c,0.25,False,False,near_mint,en,USD,Creature — Vampire Berserker,{R},R,R,"Each Vampire creature card you own that isn't on the battlefield has madness. The madness cost is equal to its mana cost. (If you discard a card with madness, discard it into exile. When you do, cast it for its madness cost or put it into your graveyard.)",legal,not_legal,https://cards.scryfall.io/normal/front/1/6/16c376f5-f69b-49d4-95f4-92bdd68c564c.jpg?1736468131
"Yavimaya, Cradle of Growth",LTC,Tales of Middle-earth Commander,377,foil,mythic,1,83641,f442758d-4fee-43fa-a2cb-d09c326da149,47.25,False,False,near_mint,en,USD,Legendary Land,,,,Each land is a Forest in addition to its other land types.,legal,not_legal,https://cards.scryfall.io/normal/front/f/4/f442758d-4fee-43fa-a2cb-d09c326da149.jpg?1687551628
"Far Fortune, End Boss",DFT,Aetherdrift,203,foil,rare,1,103367,f523e96d-9df1-4854-accb-9876aef787e5,0.25,False,False,near_mint,en,USD,Legendary Creature — Human Mercenary,{2}{B}{R},"B, R","B, R","Start your engines! (If you have no speed, it starts at 1. It increases once on each of your turns when an opponent loses life. Max speed is 4.)
Whenever you attack, Far Fortune deals 1 damage to each opponent.
Max speed — If a source you control would deal damage to an opponent or a permanent an opponent controls, it deals that much damage plus 1 instead.",legal,not_legal,https://cards.scryfall.io/normal/front/f/5/f523e96d-9df1-4854-accb-9876aef787e5.jpg?1738356643
Far Out,UNF,Unfinity,8,normal,mythic,1,72830,89c47667-1ae3-464b-9c5f-732a08a53707,0.25,False,False,near_mint,en,USD,Enchantment,{2}{W},W,W,"Rather than choose the indicated number of modes for spells and abilities you control, you may choose one or more modes. You can't choose any mode more than once.",not_legal,not_legal,https://cards.scryfall.io/normal/front/8/9/89c47667-1ae3-464b-9c5f-732a08a53707.jpg?1673913086
Farsight Ritual,WOE,Wilds of Eldraine,332,foil,rare,1,85621,a3f484b9-486f-4aff-8b23-d8e555b476d3,0.39,False,False,near_mint,en,USD,Instant,{2}{U}{U},U,U,"Bargain (You may sacrifice an artifact, enchantment, or token as you cast this spell.)
Look at the top four cards of your library. If this spell was bargained, look at the top eight cards of your library instead. Put two of them into your hand and the rest on the bottom of your library in a random order.",legal,not_legal,https://cards.scryfall.io/normal/front/a/3/a3f484b9-486f-4aff-8b23-d8e555b476d3.jpg?1692940747
Fated Retribution,BNG,Born of the Gods,11,normal,rare,1,14949,8158b330-2868-4147-907e-4d86e44cfaad,0.35,False,False,near_mint,en,USD,Instant,{4}{W}{W}{W},W,W,"Destroy all creatures and planeswalkers. If it's your turn, scry 2.",legal,not_legal,https://cards.scryfall.io/normal/front/8/1/8158b330-2868-4147-907e-4d86e44cfaad.jpg?1593091437
Feldon's Cane,CHR,Chronicles,97,normal,common,1,39329,38ae4abb-f16e-4433-ac1a-e4be57dc652b,0.41,False,False,near_mint,en,USD,Artifact,{1},,,"{T}, Exile this artifact: Shuffle your graveyard into your library.",legal,legal,https://cards.scryfall.io/normal/front/3/8/38ae4abb-f16e-4433-ac1a-e4be57dc652b.jpg?1562906414
Fell the Profane // Fell Mire,MH3,Modern Horizons 3,244,foil,uncommon,1,94566,a3cb782d-c459-468d-9779-9b5669abc337,5.66,False,False,near_mint,en,USD,Instant // Land,,,B,,legal,not_legal,https://cards.scryfall.io/normal/front/a/3/a3cb782d-c459-468d-9779-9b5669abc337.jpg?1717013242
Ferris Wheel,UNF,Unfinity,210,normal,rare,1,72841,91562ab3-1153-48d9-9f8e-4c79155548f2,0.45,False,False,near_mint,en,USD,Artifact — Attraction,,,,Visit — Choose target creature that hasn't been phased out with this Attraction. That creature phases out until you roll a 3 or less while rolling to visit your Attractions.,legal,not_legal,https://cards.scryfall.io/normal/front/9/1/91562ab3-1153-48d9-9f8e-4c79155548f2.jpg?1673915585
Final Fortune,MB2,Mystery Booster 2,190,normal,rare,1,96643,0be24cbb-233b-4007-b980-5aa77daaa513,8.1,False,False,near_mint,en,USD,Instant,{R}{R},R,R,"Take an extra turn after this one. At the beginning of that turn's end step, you lose the game.",legal,not_legal,https://cards.scryfall.io/normal/front/0/b/0be24cbb-233b-4007-b980-5aa77daaa513.jpg?1723222793
Fireflux Squad,C20,Commander 2020,51,normal,rare,1,50367,4bcff20b-06f7-4228-a99c-6ff46e73e353,0.45,False,False,near_mint,en,USD,Creature — Human Soldier,{3}{R},R,R,"Haste
Whenever this creature attacks, you may exile another target attacking creature you control. If you do, reveal cards from the top of your library until you reveal a creature card. Put that card onto the battlefield tapped and attacking and the rest on the bottom of your library in a random order.",legal,not_legal,https://cards.scryfall.io/normal/front/4/b/4bcff20b-06f7-4228-a99c-6ff46e73e353.jpg?1591319589
Firja's Retribution,KHM,Kaldheim,210,normal,rare,1,56736,03dff23e-d7e3-4d75-a9dc-fdf4a42f31e0,0.49,False,False,near_mint,en,USD,Enchantment — Saga,{1}{W}{W}{B},"B, W","B, W","(As this Saga enters and after your draw step, add a lore counter. Sacrifice after III.)
I — Create a 4/4 white Angel Warrior creature token with flying and vigilance.
II — Until end of turn, Angels you control gain ""{T}: Destroy target creature with power less than this creature's power.""
III — Angels you control gain double strike until end of turn.",legal,not_legal,https://cards.scryfall.io/normal/front/0/3/03dff23e-d7e3-4d75-a9dc-fdf4a42f31e0.jpg?1631051388
Flagstones of Trokair,TSR,Time Spiral Remastered,278,normal,rare,1,57772,a0acea27-88de-4d27-8da2-8f82439526a1,4.88,False,False,near_mint,en,USD,Legendary Land,,,W,"{T}: Add {W}.
When Flagstones of Trokair is put into a graveyard from the battlefield, you may search your library for a Plains card, put it onto the battlefield tapped, then shuffle.",legal,not_legal,https://cards.scryfall.io/normal/front/a/0/a0acea27-88de-4d27-8da2-8f82439526a1.jpg?1619399261
Flare of Cultivation,MH3,Modern Horizons 3,425,normal,rare,2,91774,b057c3e0-9d1e-4136-be70-ff34701a2cb7,1.64,False,False,near_mint,en,USD,Sorcery,{1}{G}{G},G,G,"You may sacrifice a nontoken green creature rather than pay this spell's mana cost.
Search your library for up to two basic land cards, reveal those cards, put one onto the battlefield tapped and the other into your hand, then shuffle.",legal,not_legal,https://cards.scryfall.io/normal/front/b/0/b057c3e0-9d1e-4136-be70-ff34701a2cb7.jpg?1738521599
Flare of Denial,MH3,Modern Horizons 3,62,foil,rare,1,94232,71a98efb-9b0a-496b-ac21-8d70527ea544,6.99,False,False,near_mint,en,USD,Instant,{1}{U}{U},U,U,"You may sacrifice a nontoken blue creature rather than pay this spell's mana cost.
Counter target spell.",legal,not_legal,https://cards.scryfall.io/normal/front/7/1/71a98efb-9b0a-496b-ac21-8d70527ea544.jpg?1717470464
Flare of Cultivation,MH3,Modern Horizons 3,154,normal,rare,1,91777,bda2fa87-81c0-41ac-8831-556ce392c058,1.2,False,False,near_mint,en,USD,Sorcery,{1}{G}{G},G,G,"You may sacrifice a nontoken green creature rather than pay this spell's mana cost.
Search your library for up to two basic land cards, reveal those cards, put one onto the battlefield tapped and the other into your hand, then shuffle.",legal,not_legal,https://cards.scryfall.io/normal/front/b/d/bda2fa87-81c0-41ac-8831-556ce392c058.jpg?1717470461
Flare of Denial,MH3,Modern Horizons 3,62,normal,rare,1,94232,71a98efb-9b0a-496b-ac21-8d70527ea544,5.33,False,False,near_mint,en,USD,Instant,{1}{U}{U},U,U,"You may sacrifice a nontoken blue creature rather than pay this spell's mana cost.
Counter target spell.",legal,not_legal,https://cards.scryfall.io/normal/front/7/1/71a98efb-9b0a-496b-ac21-8d70527ea544.jpg?1717470464
Flare of Malice,MH3,Modern Horizons 3,331,foil,rare,1,94626,d1822be1-9316-40c7-871d-25b0a5dea755,8.26,False,False,near_mint,en,USD,Instant,{2}{B}{B},B,B,"You may sacrifice a nontoken black creature rather than pay this spell's mana cost.
Each opponent sacrifices a creature or planeswalker with the greatest mana value among creatures and planeswalkers they control.",legal,not_legal,https://cards.scryfall.io/normal/front/d/1/d1822be1-9316-40c7-871d-25b0a5dea755.jpg?1717014143
Flawless Maneuver,SLD,Secret Lair Drop,1728,normal,rare,2,100017,becd6a66-51b5-4ef1-a8a4-f65343bda3f8,17.7,False,False,near_mint,en,USD,Instant,{2}{W},W,W,"If you control a commander, you may cast this spell without paying its mana cost.
Creatures you control gain indestructible until end of turn.",legal,not_legal,https://cards.scryfall.io/normal/front/b/e/becd6a66-51b5-4ef1-a8a4-f65343bda3f8.jpg?1729274152
Flesh Duplicate,WHO,Doctor Who,950,foil,rare,1,87178,2b37617e-bba7-4d85-8092-9b43be7fec40,24.41,False,False,near_mint,en,USD,Creature — Shapeshifter Rebel,{U}{U},U,U,"You may have this creature enter as a copy of any creature on the battlefield, except it has vanishing 3 if that creature doesn't have vanishing. (A permanent with vanishing 3 enters with three time counters on it. At the beginning of your upkeep, remove a time counter from it. When the last is removed, sacrifice it.)",legal,not_legal,https://cards.scryfall.io/normal/front/2/b/2b37617e-bba7-4d85-8092-9b43be7fec40.jpg?1696638454
Flickering Ward,MB2,Mystery Booster 2,11,normal,uncommon,1,96957,a41ed670-f1bd-4785-9347-fea7b93a462f,1.89,False,False,near_mint,en,USD,Enchantment — Aura,{W},W,W,"Enchant creature
As this Aura enters, choose a color.
Enchanted creature has protection from the chosen color. This effect doesn't remove this Aura.
{W}: Return this Aura to its owner's hand.",legal,not_legal,https://cards.scryfall.io/normal/front/a/4/a41ed670-f1bd-4785-9347-fea7b93a462f.jpg?1723226331
Floodfarm Verge,DSK,Duskmourn: House of Horror,259,normal,rare,1,98745,d53ed0db-1199-44b3-8eda-8189dfcf53d1,8.95,False,False,near_mint,en,USD,Land,,,"U, W","{T}: Add {W}.
{T}: Add {U}. Activate only if you control a Plains or an Island.",legal,not_legal,https://cards.scryfall.io/normal/front/d/5/d53ed0db-1199-44b3-8eda-8189dfcf53d1.jpg?1726286841
"Florian, Voldaren Scion",DBL,Innistrad: Double Feature,223,normal,rare,1,65180,37fd06c9-0656-43b3-93ab-ca378f3065a7,0.75,False,False,near_mint,en,USD,Legendary Creature — Vampire Noble,{1}{B}{R},"B, R","B, R","First strike
At the beginning of each of your postcombat main phases, look at the top X cards of your library, where X is the total amount of life your opponents lost this turn. Exile one of those cards and put the rest on the bottom of your library in a random order. You may play the exiled card this turn.",legal,not_legal,https://cards.scryfall.io/normal/front/3/7/37fd06c9-0656-43b3-93ab-ca378f3065a7.jpg?1673160826
Form of the Approach of the Second Sun,UNF,Unfinity,9,foil,rare,1,72672,2149da9d-35ad-4f32-8072-fb515100b2fd,0.25,False,False,near_mint,en,USD,Enchantment,{4}{W},W,W,"When this enchantment enters, you gain 7 life. You become a card until you leave your library or that library is shuffled. Put yourself seventh from the top, balancing the cards on top of you on your head.
When you draw yourself, you win the game.
When one or more cards fall off your head, exile them and all cards on your head, then sacrifice this enchantment.",not_legal,not_legal,https://cards.scryfall.io/normal/front/2/1/2149da9d-35ad-4f32-8072-fb515100b2fd.jpg?1673913099
Fortify,2XM,Double Masters,17,foil,common,1,52123,4974169a-f454-4b8a-9301-18498c73c5ab,0.25,False,False,near_mint,en,USD,Instant,{2}{W},W,W,"Choose one —
• Creatures you control get +2/+0 until end of turn.
• Creatures you control get +0/+2 until end of turn.",legal,legal,https://cards.scryfall.io/normal/front/4/9/4974169a-f454-4b8a-9301-18498c73c5ab.jpg?1599707254
Fountainport,BLB,Bloomburrow,368,normal,rare,1,96126,dd04367b-59d8-4ee6-8b5a-abfb1373c226,4.99,False,False,near_mint,en,USD,Land,,,,"{T}: Add {C}.
{2}, {T}, Sacrifice a token: Draw a card.
{3}, {T}, Pay 1 life: Create a 1/1 blue Fish creature token.
{4}, {T}: Create a Treasure token.",legal,not_legal,https://cards.scryfall.io/normal/front/d/d/dd04367b-59d8-4ee6-8b5a-abfb1373c226.jpg?1721427974
Freestrider Lookout,OTJ,Outlaws of Thunder Junction,340,normal,rare,1,93236,81289833-ebdb-4fe7-ad17-6e39eb399e69,1.32,False,False,near_mint,en,USD,Creature — Human Rogue,{2}{G},G,G,"Reach
Whenever you commit a crime, look at the top five cards of your library. You may put a land card from among them onto the battlefield tapped. Put the rest on the bottom of your library in a random order. This ability triggers only once each turn. (Targeting opponents, anything they control, and/or cards in their graveyards is a crime.)",legal,not_legal,https://cards.scryfall.io/normal/front/8/1/81289833-ebdb-4fe7-ad17-6e39eb399e69.jpg?1712356700
Friarball,MB2,Mystery Booster 2,514,normal,rare,1,96774,4d97d719-3a1e-4160-b393-71e289e005e0,0.25,False,False,near_mint,en,USD,Sorcery,{3}{W},W,W,"Create a 2/2 white Monk creature token.
Coststorm (When you cast this spell, copy it for each different mana value among other spells and lands you've played this turn.)",not_legal,not_legal,https://cards.scryfall.io/normal/front/4/d/4d97d719-3a1e-4160-b393-71e289e005e0.jpg?1723373748
Full Throttle,DFT,Aetherdrift,127,foil,rare,1,103297,d91f7cad-89e8-45cb-a78e-b35b0ee64783,2.9,False,False,near_mint,en,USD,Sorcery,{4}{R}{R},R,R,"After this main phase, there are two additional combat phases.
At the beginning of each combat this turn, untap all creatures that attacked this turn.",legal,not_legal,https://cards.scryfall.io/normal/front/d/9/d91f7cad-89e8-45cb-a78e-b35b0ee64783.jpg?1738356414
Funeral Room // Awakening Hall,DSK,Duskmourn: House of Horror,338,normal,mythic,1,98928,da30e940-acba-4f10-bd0e-3a0b165233f9,6.38,False,False,near_mint,en,USD,Enchantment — Room // Enchantment — Room,{2}{B} // {6}{B}{B},B,B,,legal,not_legal,https://cards.scryfall.io/normal/front/d/a/da30e940-acba-4f10-bd0e-3a0b165233f9.jpg?1726780638
Funeral Room // Awakening Hall,DSK,Duskmourn: House of Horror,100,normal,mythic,1,98818,48237c98-5067-47a8-af74-7b9bce57c6a4,4.76,False,False,near_mint,en,USD,Enchantment — Room // Enchantment — Room,{2}{B} // {6}{B}{B},B,B,,legal,not_legal,https://cards.scryfall.io/normal/front/4/8/48237c98-5067-47a8-af74-7b9bce57c6a4.jpg?1726867790
Fear of Missing Out,DSK,Duskmourn: House of Horror,316,normal,rare,2,98598,45b924a5-6533-4ca6-bd2e-32debdfb6c08,5.5,False,False,near_mint,en,USD,Enchantment Creature — Nightmare,{1}{R},R,R,"When this creature enters, discard a card, then draw a card.
Delirium — Whenever this creature attacks for the first time each turn, if there are four or more card types among cards in your graveyard, untap target creature. After this phase, there is an additional combat phase.",legal,not_legal,https://cards.scryfall.io/normal/front/4/5/45b924a5-6533-4ca6-bd2e-32debdfb6c08.jpg?1726287061
Galewind Moose,BLB,Bloomburrow,173,normal,uncommon,1,95871,58706bd8-558a-43b9-9f1e-c1ff0044203b,0.19,False,False,near_mint,en,USD,Creature — Elemental Elk,{4}{G}{G},G,G,"Flash
Vigilance, reach, trample",legal,not_legal,https://cards.scryfall.io/normal/front/5/8/58706bd8-558a-43b9-9f1e-c1ff0044203b.jpg?1721426814
Gallery of Legends,UNF,Unfinity,213a,normal,rare,1,72883,a9ad0d58-b1f6-4549-b0b3-f655b006dbb4,0.25,False,False,near_mint,en,USD,Artifact — Attraction,,,,"Visit — Exile cards from the top of your library until you exile a nonland card, then choose a legendary creature card name with the same mana value as that card. Create a token that's a copy of the card with the chosen name. That token gains haste. Exile it at the beginning of the next end step.",not_legal,not_legal,https://cards.scryfall.io/normal/front/a/9/a9ad0d58-b1f6-4549-b0b3-f655b006dbb4.jpg?1673915680
Gauntlet of Power,TSR,Time Spiral Remastered,267,foil,mythic,1,57529,14e870a0-5699-4f42-b67a-8dbd24e0c9c2,4.99,False,False,near_mint,en,USD,Artifact,{5},,,"As this artifact enters, choose a color.
Creatures of the chosen color get +1/+1.
Whenever a basic land is tapped for mana of the chosen color, its controller adds an additional one mana of that color.",legal,not_legal,https://cards.scryfall.io/normal/front/1/4/14e870a0-5699-4f42-b67a-8dbd24e0c9c2.jpg?1619404297
General Kudro of Drannith,IKO,Ikoria: Lair of Behemoths,335,normal,mythic,1,49742,e6eb6b97-8b87-4565-940a-01a7fd79a989,2.54,False,False,near_mint,en,USD,Legendary Creature — Human Soldier,{1}{W}{B},"B, W","B, W","Other Humans you control get +1/+1.
Whenever General Kudro or another Human you control enters, exile target card from an opponent's graveyard.
{2}, Sacrifice two Humans: Destroy target creature with power 4 or greater.",legal,not_legal,https://cards.scryfall.io/normal/front/e/6/e6eb6b97-8b87-4565-940a-01a7fd79a989.jpg?1604782374
Generous Gift,CMM,Commander Masters,26,normal,common,1,84107,1a8c02ab-6348-4b04-8ce0-b36309a14a5e,0.75,False,False,near_mint,en,USD,Instant,{2}{W},W,W,Destroy target permanent. Its controller creates a 3/3 green Elephant creature token.,legal,legal,https://cards.scryfall.io/normal/front/1/a/1a8c02ab-6348-4b04-8ce0-b36309a14a5e.jpg?1689995694
Get Lost,LCI,The Lost Caverns of Ixalan,333,foil,rare,1,88626,7d60e0bc-1ce1-4b91-9952-16b394b5a348,7.0,False,False,near_mint,en,USD,Instant,{1}{W},W,W,"Destroy target creature, enchantment, or planeswalker. Its controller creates two Map tokens. (They're artifacts with ""{1}, {T}, Sacrifice this token: Target creature you control explores. Activate only as a sorcery."")",legal,not_legal,https://cards.scryfall.io/normal/front/7/d/7d60e0bc-1ce1-4b91-9952-16b394b5a348.jpg?1699044877
Get Lost,LCI,The Lost Caverns of Ixalan,333,normal,rare,1,88626,7d60e0bc-1ce1-4b91-9952-16b394b5a348,4.99,False,False,near_mint,en,USD,Instant,{1}{W},W,W,"Destroy target creature, enchantment, or planeswalker. Its controller creates two Map tokens. (They're artifacts with ""{1}, {T}, Sacrifice this token: Target creature you control explores. Activate only as a sorcery."")",legal,not_legal,https://cards.scryfall.io/normal/front/7/d/7d60e0bc-1ce1-4b91-9952-16b394b5a348.jpg?1699044877
Get Lost,LCI,The Lost Caverns of Ixalan,14,foil,rare,1,88497,522aa72b-2b8c-484c-872b-f082101cee35,5.39,False,False,near_mint,en,USD,Instant,{1}{W},W,W,"Destroy target creature, enchantment, or planeswalker. Its controller creates two Map tokens. (They're artifacts with ""{1}, {T}, Sacrifice this token: Target creature you control explores. Activate only as a sorcery."")",legal,not_legal,https://cards.scryfall.io/normal/front/5/2/522aa72b-2b8c-484c-872b-f082101cee35.jpg?1699043186
"Ghalta, Primal Hunger",CMM,Commander Masters,292,normal,rare,1,84376,54872e72-41dc-4092-8169-ce13498beb30,0.82,False,False,near_mint,en,USD,Legendary Creature — Elder Dinosaur,{10}{G}{G},G,G,"This spell costs {X} less to cast, where X is the total power of creatures you control.
Trample (This creature can deal excess combat damage to the player or planeswalker it's attacking.)",legal,not_legal,https://cards.scryfall.io/normal/front/5/4/54872e72-41dc-4092-8169-ce13498beb30.jpg?1689998553
Ghost Vacuum,DSK,Duskmourn: House of Horror,248,normal,rare,1,98722,8ac39c01-127f-4471-bc74-11a90c48e306,5.25,False,False,near_mint,en,USD,Artifact,{1},,,"{T}: Exile target card from a graveyard.
{6}, {T}, Sacrifice this artifact: Put each creature card exiled with this artifact onto the battlefield under your control with a flying counter on it. Each of them is a 1/1 Spirit in addition to its other types. Activate only as a sorcery.",legal,not_legal,https://cards.scryfall.io/normal/front/8/a/8ac39c01-127f-4471-bc74-11a90c48e306.jpg?1726286797
Ghost Vacuum,DSK,Duskmourn: House of Horror,326,foil,rare,1,98729,abf254c0-7c3c-4b68-8b3e-4ae444baa886,5.44,False,False,near_mint,en,USD,Artifact,{1},,,"{T}: Exile target card from a graveyard.
{6}, {T}, Sacrifice this artifact: Put each creature card exiled with this artifact onto the battlefield under your control with a flying counter on it. Each of them is a 1/1 Spirit in addition to its other types. Activate only as a sorcery.",legal,not_legal,https://cards.scryfall.io/normal/front/a/b/abf254c0-7c3c-4b68-8b3e-4ae444baa886.jpg?1726287102
Ghost Vacuum,DSK,Duskmourn: House of Horror,326,normal,rare,1,98729,abf254c0-7c3c-4b68-8b3e-4ae444baa886,4.95,False,False,near_mint,en,USD,Artifact,{1},,,"{T}: Exile target card from a graveyard.
{6}, {T}, Sacrifice this artifact: Put each creature card exiled with this artifact onto the battlefield under your control with a flying counter on it. Each of them is a 1/1 Spirit in addition to its other types. Activate only as a sorcery.",legal,not_legal,https://cards.scryfall.io/normal/front/a/b/abf254c0-7c3c-4b68-8b3e-4ae444baa886.jpg?1726287102
"Giada, Font of Hope",FDN,Foundations,298,normal,rare,1,100141,0b235e9f-a8a6-45d7-b301-bc6db752dda8,3.49,False,False,near_mint,en,USD,Legendary Creature — Angel,{1}{W},W,W,"Flying, vigilance
Each other Angel you control enters with an additional +1/+1 counter on it for each Angel you already control.
{T}: Add {W}. Spend this mana only to cast an Angel spell.",legal,not_legal,https://cards.scryfall.io/normal/front/0/b/0b235e9f-a8a6-45d7-b301-bc6db752dda8.jpg?1730489714
Gift Shop,UNF,Unfinity,214a,normal,rare,1,72642,0be723e0-4e14-4910-905c-0292b84a0272,0.25,False,False,near_mint,en,USD,Artifact — Attraction,,,,"Visit — Choose one that hasn't been chosen.
• Create a 1/1 red Balloon creature token with flying.
• Create a 2/2 pink Teddy Bear creature token.
• Create two Food tokens.
• You get {TK}{TK}{TK}.
• You may put a sticker on a nonland permanent you own.",not_legal,not_legal,https://cards.scryfall.io/normal/front/0/b/0be723e0-4e14-4910-905c-0292b84a0272.jpg?1673915698
