Name,Set code,Set name,Collector number,Foil,Rarity,Quantity,ManaBox ID,Scryfall ID,Purchase price,Misprint,Altered,Condition,Language,Purchase price currency,type_line,mana_cost,colors,color_identity,oracle_text,legal_commander,legal_pauper,image_url
Gloomlake Verge,DSK,Duskmourn: House of Horror,331,foil,rare,1,98903,b414e4bd-a443-4ab3-bee4-1ad1d039aa1a,24.7,False,False,near_mint,en,USD,Land,,,"B, U","{T}: Add {U}.
{T}: Add {B}. Activate only if you control an Island or a Swamp.",legal,not_legal,https://cards.scryfall.io/normal/front/b/4/b414e4bd-a443-4ab3-bee4-1ad1d039aa1a.jpg?1737649070
Gloomlake Verge,DSK,Duskmourn: House of Horror,260,foil,rare,1,98717,83f510b7-4cbd-4883-9c26-c8824bc668ac,11.57,False,False,near_mint,en,USD,Land,,,"B, U","{T}: Add {U}.
{T}: Add {B}. Activate only if you control an Island or a Swamp.",legal,not_legal,https://cards.scryfall.io/normal/front/8/3/83f510b7-4cbd-4883-9c26-c8824bc668ac.jpg?1726286844
Glorious Protector,KHM,Kaldheim,335,normal,rare,1,56748,0d5008bc-edbc-4ad1-9a06-7eea5723db26,0.82,False,False,near_mint,en,USD,Creature — Angel Cleric,{2}{W}{W},W,W,"Flash
Flying
When this creature enters, you may exile any number of non-Angel creatures you control until this creature leaves the battlefield.
Foretell {2}{W}",legal,not_legal,https://cards.scryfall.io/normal/front/0/d/0d5008bc-edbc-4ad1-9a06-7eea5723db26.jpg?1631055669
Glory,DMR,Dominaria Remastered,264,normal,rare,1,77934,60ada52e-073c-4775-a190-310d51569682,0.29,False,False,near_mint,en,USD,Creature — Incarnation,{3}{W}{W},W,W,"Flying
{2}{W}: Choose a color. Creatures you control gain protection from the chosen color until end of turn. Activate only if this card is in your graveyard.",legal,not_legal,https://cards.scryfall.io/normal/front/6/0/60ada52e-073c-4775-a190-310d51569682.jpg?1675201388
Goblin Engineer,TSR,Time Spiral Remastered,345,normal,special,1,57587,31f675f6-df29-4b90-a5e6-26d915fdc6a1,7.72,False,False,near_mint,en,USD,Creature — Goblin Artificer,{1}{R},R,R,"When this creature enters, you may search your library for an artifact card, put it into your graveyard, then shuffle.
{R}, {T}, Sacrifice an artifact: Return target artifact card with mana value 3 or less from your graveyard to the battlefield.",legal,not_legal,https://cards.scryfall.io/normal/front/3/1/31f675f6-df29-4b90-a5e6-26d915fdc6a1.jpg?1619401562
"Goddric, Cloaked Reveler",WOE,Wilds of Eldraine,132,foil,rare,1,85862,fe93ef82-51de-40ad-9b52-8f3fd11c144f,0.3,False,False,near_mint,en,USD,Legendary Creature — Human Noble,{1}{R}{R},R,R,"Haste
Celebration — As long as two or more nonland permanents entered the battlefield under your control this turn, Goddric is a Dragon with base power and toughness 4/4, flying, and ""{R}: Dragons you control get +1/+0 until end of turn."" (It loses all other creature types.)",legal,not_legal,https://cards.scryfall.io/normal/front/f/e/fe93ef82-51de-40ad-9b52-8f3fd11c144f.jpg?1692938249
Goldspan Dragon,SLD,Secret Lair Drop,1780,normal,mythic,1,97225,1183d4d7-094b-4024-ab1d-23c458cb7e71,30.0,False,False,near_mint,en,USD,Creature — Dragon,{3}{R}{R},R,R,"Flying, haste
Whenever this creature attacks or becomes the target of a spell, create a Treasure token.
Treasures you control have ""{T}, Sacrifice this artifact: Add two mana of any one color.""",legal,not_legal,https://cards.scryfall.io/normal/front/1/1/1183d4d7-094b-4024-ab1d-23c458cb7e71.jpg?1726868808
Grand Abolisher,BIG,The Big Score,67,normal,mythic,1,93496,1439551c-6764-4c35-a5ba-c7adb727cf7a,14.82,False,False,near_mint,en,USD,Creature — Human Cleric,{W}{W},W,W,"During your turn, your opponents can't cast spells or activate abilities of artifacts, creatures, or enchantments.",legal,not_legal,https://cards.scryfall.io/normal/front/1/4/1439551c-6764-4c35-a5ba-c7adb727cf7a.jpg?1712353251
Grand Architect,2XM,Double Masters,53,normal,rare,1,51822,14ce909d-a53e-4711-a9fd-b110433d460f,2.0,False,False,near_mint,en,USD,Creature — Vedalken Artificer,{1}{U}{U},U,U,"Other blue creatures you control get +1/+1.
{U}: Target artifact creature becomes blue until end of turn.
Tap an untapped blue creature you control: Add {C}{C}. Spend this mana only to cast artifact spells or activate abilities of artifacts.",legal,not_legal,https://cards.scryfall.io/normal/front/1/4/14ce909d-a53e-4711-a9fd-b110433d460f.jpg?1598303952
Graveblade Marauder,J22,Jumpstart 2022,422,normal,rare,1,76179,2c5c03c6-123b-4d4d-878e-0158659bf27b,0.25,False,False,near_mint,en,USD,Creature — Human Warrior,{2}{B},B,B,"Deathtouch (Any amount of damage this deals to a creature is enough to destroy it.)
Whenever this creature deals combat damage to a player, that player loses life equal to the number of creature cards in your graveyard.",legal,not_legal,https://cards.scryfall.io/normal/front/2/c/2c5c03c6-123b-4d4d-878e-0158659bf27b.jpg?1675649540
Gray Merchant of Asphodel,TSR,Time Spiral Remastered,323,normal,special,1,57671,5be62041-fec2-44e0-aec9-5368d1c7f1da,8.67,False,False,near_mint,en,USD,Creature — Zombie,{3}{B}{B},B,B,"When this creature enters, each opponent loses X life, where X is your devotion to black. You gain life equal to the life lost this way. (Each {B} in the mana costs of permanents you control counts toward your devotion to black.)",legal,legal,https://cards.scryfall.io/normal/front/5/b/5be62041-fec2-44e0-aec9-5368d1c7f1da.jpg?1619400831
Gray Merchant of Alphabet,UNF,Unfinity,75,foil,uncommon,1,73070,2fbf4ab1-f558-41fb-a7b5-3e543a307e1c,0.25,False,False,near_mint,en,USD,Creature — Zombie Performer,{3}{B}{B},B,B,"When this creature enters, choose a letter. For each creature you control that has the chosen letter in its name, you gain 1 life and each opponent loses 1 life.",not_legal,not_legal,https://cards.scryfall.io/normal/front/2/f/2fbf4ab1-f558-41fb-a7b5-3e543a307e1c.jpg?1673913877
Graywater's Fixer,OTC,Outlaws of Thunder Junction Commander,72,normal,rare,1,93884,d9e3ebb0-0294-4f50-b65e-359fb3e7ab53,0.3,False,False,near_mint,en,USD,Creature — Lizard Mercenary,{2}{B}{R},"B, R","B, R","Each outlaw creature card in your graveyard has encore {X}, where X is its mana value. (Exile it and pay its encore cost: For each opponent, create a token copy that attacks that opponent this turn if able. They gain haste. Sacrifice them at the beginning of the next end step. Activate only as a sorcery.)",legal,not_legal,https://cards.scryfall.io/normal/front/d/9/d9e3ebb0-0294-4f50-b65e-359fb3e7ab53.jpg?1712354041
Greater Gargadon,TSR,Time Spiral Remastered,167,normal,rare,1,57922,ef6d6eb2-beed-4c84-af6a-bf8ebdc62f50,0.35,False,False,near_mint,en,USD,Creature — Beast,{9}{R},R,R,"Suspend 10—{R}
Sacrifice an artifact, creature, or land: Remove a time counter from this card. Activate only if this card is suspended.",legal,not_legal,https://cards.scryfall.io/normal/front/e/f/ef6d6eb2-beed-4c84-af6a-bf8ebdc62f50.jpg?1619397056
Greatest Show in the Multiverse,UNF,Unfinity,189,normal,mythic,1,72988,f92a5413-290b-484b-b754-06ec7f1a62ac,0.25,False,False,near_mint,en,USD,Artifact Enchantment — Saga,{7},,,"(As this Saga enters and after your draw step, add a lore counter. Sacrifice after III.)
As an additional cost to cast this spell, exile five instant and/or sorcery cards you own with the same artist and different names from outside the game.
I, II, III — Choose one of the exiled cards at random. You may cast it without paying its mana cost.",not_legal,not_legal,https://cards.scryfall.io/normal/front/f/9/f92a5413-290b-484b-b754-06ec7f1a62ac.jpg?1740484016
Green Sun's Zenith,2X2,Double Masters 2022,461,etched,rare,1,70239,586fdc7a-add9-4ed6-88f6-188061647c31,70.48,False,False,near_mint,en,USD,Sorcery,{X}{G},G,G,"Search your library for a green creature card with mana value X or less, put it onto the battlefield, then shuffle. Shuffle Green Sun's Zenith into its owner's library.",legal,not_legal,https://cards.scryfall.io/normal/front/5/8/586fdc7a-add9-4ed6-88f6-188061647c31.jpg?1681411353
Grinding Station,MB2,Mystery Booster 2,223,normal,uncommon,2,97078,e179eab9-acd8-44e9-a4a7-0a33a5195be5,9.21,False,False,near_mint,en,USD,Artifact,{2},,,"{T}, Sacrifice an artifact: Target player mills three cards.
Whenever an artifact enters, you may untap this artifact.",legal,not_legal,https://cards.scryfall.io/normal/front/e/1/e179eab9-acd8-44e9-a4a7-0a33a5195be5.jpg?1723224426
Griselbrand,INR,Innistrad Remastered,485,normal,mythic,1,102691,9bc860fe-af9e-44d8-82e6-da0a24466378,7.98,False,False,near_mint,en,USD,Legendary Creature — Demon,{4}{B}{B}{B}{B},B,B,"Flying, lifelink
Pay 7 life: Draw seven cards.",banned,not_legal,https://cards.scryfall.io/normal/front/9/b/9bc860fe-af9e-44d8-82e6-da0a24466378.jpg?1744789850
Griselbrand,INR,Innistrad Remastered,381,normal,mythic,1,102787,d06b486e-14c5-4368-b4e6-7b942f400b25,3.21,False,False,near_mint,en,USD,Legendary Creature — Demon,{4}{B}{B}{B}{B},B,B,"Flying, lifelink
Pay 7 life: Draw seven cards.",banned,not_legal,https://cards.scryfall.io/normal/front/d/0/d06b486e-14c5-4368-b4e6-7b942f400b25.jpg?1736551622
Guardian of Faith,AFR,Adventures in the Forgotten Realms,18,normal,rare,1,60141,08e3dda1-a1d3-48c9-8c81-da7eae20ac8a,4.15,False,False,near_mint,en,USD,Creature — Spirit Knight,{1}{W}{W},W,W,"Flash
Vigilance
When this creature enters, any number of other target creatures you control phase out. (Treat them and anything attached to them as though they don't exist until their controller's next turn.)",legal,not_legal,https://cards.scryfall.io/normal/front/0/8/08e3dda1-a1d3-48c9-8c81-da7eae20ac8a.jpg?1627701793
Guardian of New Benalia,DMU,Dominaria United,19,normal,rare,1,71410,43da76ee-fec3-4b2e-915d-10cf8d518d2c,0.27,False,False,near_mint,en,USD,Creature — Human Soldier,{1}{W},W,W,"Enlist (As this creature attacks, you may tap a nonattacking creature you control without summoning sickness. When you do, add its power to this creature's until end of turn.)
Whenever this creature enlists a creature, scry 2.
Discard a card: This creature gains indestructible until end of turn. Tap it.",legal,not_legal,https://cards.scryfall.io/normal/front/4/3/43da76ee-fec3-4b2e-915d-10cf8d518d2c.jpg?1673306449
Guardian Sunmare,DFT,Aetherdrift,334,normal,rare,1,103463,309072be-b813-42bd-adaf-7d45053029c0,0.45,False,False,near_mint,en,USD,Creature — Horse Mount,{3}{W}{W},W,W,"Ward {2}
Whenever this creature attacks while saddled, search your library for a nonland permanent card with mana value 3 or less, put it onto the battlefield, then shuffle.
Saddle 4",legal,not_legal,https://cards.scryfall.io/normal/front/3/0/309072be-b813-42bd-adaf-7d45053029c0.jpg?1738357301
Gumdrop Poisoner // Tempt with Treats,WOE,Wilds of Eldraine,280,foil,rare,1,85810,ec5d0453-ef17-47f0-81d4-13941f1380d5,0.36,False,False,near_mint,en,USD,Creature — Human Warlock // Instant — Adventure,{2}{B} // {B},B,B,,legal,not_legal,https://cards.scryfall.io/normal/front/e/c/ec5d0453-ef17-47f0-81d4-13941f1380d5.jpg?1692940210
Gurmag Angler,TSR,Time Spiral Remastered,324,normal,special,2,57596,361fe303-34a5-4d12-b927-dfb858699c6c,0.95,False,False,near_mint,en,USD,Creature — Zombie Fish,{6}{B},B,B,Delve (Each card you exile from your graveyard while casting this spell pays for {1}.),legal,legal,https://cards.scryfall.io/normal/front/3/6/361fe303-34a5-4d12-b927-dfb858699c6c.jpg?1619400856
"Harald, King of Skemfar",KHM,Kaldheim,323,foil,uncommon,1,56979,8fc37772-7052-46a9-a34e-f982331595a3,0.32,False,False,near_mint,en,USD,Legendary Creature — Elf Warrior,{1}{B}{G},"B, G","B, G","Menace (This creature can't be blocked except by two or more creatures.)
When Harald enters, look at the top five cards of your library. You may reveal an Elf, Warrior, or Tyvar card from among them and put it into your hand. Put the rest on the bottom of your library in a random order.",legal,not_legal,https://cards.scryfall.io/normal/front/8/f/8fc37772-7052-46a9-a34e-f982331595a3.jpg?1631055308
Harbinger of the Seas,MH3,Modern Horizons 3,63,normal,rare,1,94321,00212714-a410-4cbc-bf1c-f90d7d77378c,3.59,False,False,near_mint,en,USD,Creature — Merfolk Wizard,{1}{U}{U},U,U,Nonbasic lands are Islands.,legal,not_legal,https://cards.scryfall.io/normal/front/0/0/00212714-a410-4cbc-bf1c-f90d7d77378c.jpg?1717470489
Hardy of Myra's Marvels,UNF,Unfinity,141,normal,rare,1,72812,80225482-6566-41fb-ade7-d9646426a4be,0.25,False,False,near_mint,en,USD,Legendary Creature — Elf Performer,{2}{G}{G},G,G,"As Hardy of Myra's Marvels enters, choose a number.
Whenever you cast a spell with the chosen number of lines of flavor text, put that many +1/+1 counters on target creature.
Partner (You can have two commanders if both have partner.)",not_legal,not_legal,https://cards.scryfall.io/normal/front/8/0/80225482-6566-41fb-ade7-d9646426a4be.jpg?1674173530
Haunted House,UNF,Unfinity,217a,normal,rare,1,72647,0f8d4551-3adc-4ce4-bcea-1a555208de8b,0.4,False,False,near_mint,en,USD,Artifact — Attraction,,,,Visit — Return target creature card from your graveyard to the battlefield. It gains haste. Exile it at the beginning of your next end step.,legal,not_legal,https://cards.scryfall.io/normal/front/0/f/0f8d4551-3adc-4ce4-bcea-1a555208de8b.jpg?1673915771
Hedron Archive,TSR,Time Spiral Remastered,395,normal,special,1,57782,a45ca366-2a43-4930-9c16-0ba72c1de3b8,0.49,False,False,near_mint,en,USD,Artifact,{4},,,"{T}: Add {C}{C}.
{2}, {T}, Sacrifice this artifact: Draw two cards.",legal,not_legal,https://cards.scryfall.io/normal/front/a/4/a45ca366-2a43-4930-9c16-0ba72c1de3b8.jpg?1619403056
Hellkite Tyrant,RVR,Ravnica Remastered,333,normal,rare,1,89745,722cbdfd-3d25-4f7c-8bdd-be98f4a3a3f0,7.15,False,False,near_mint,en,USD,Creature — Dragon,{4}{R}{R},R,R,"Flying, trample
Whenever Hellkite Tyrant deals combat damage to a player, gain control of all artifacts that player controls.
At the beginning of your upkeep, if you control twenty or more artifacts, you win the game.",legal,not_legal,https://cards.scryfall.io/normal/front/7/2/722cbdfd-3d25-4f7c-8bdd-be98f4a3a3f0.jpg?1702419943
Heroic Intervention,SLD,Secret Lair Drop,1750,normal,rare,1,99995,02f7ffb0-ad48-4f2c-af43-a86a9546a1b2,24.63,False,False,near_mint,en,USD,Instant,{1}{G},G,G,Permanents you control gain hexproof and indestructible until end of turn.,legal,not_legal,https://cards.scryfall.io/normal/front/0/2/02f7ffb0-ad48-4f2c-af43-a86a9546a1b2.jpg?1729295822
Heroic Intervention,PM21,Core Set 2021 Promos,188p,normal,rare,1,51720,b35e310c-8104-4871-b5ca-07f1bea1e7d5,12.83,False,False,near_mint,en,USD,Instant,{1}{G},G,G,Permanents you control gain hexproof and indestructible until end of turn.,legal,not_legal,https://cards.scryfall.io/normal/front/b/3/b35e310c-8104-4871-b5ca-07f1bea1e7d5.jpg?1596311599
Hired Claw,BLB,Bloomburrow,140,foil,rare,1,95897,1ae41080-0d67-4719-adb2-49bf2a268b6c,2.14,False,False,near_mint,en,USD,Creature — Lizard Mercenary,{R},R,R,"Whenever you attack with one or more Lizards, this creature deals 1 damage to target opponent.
{1}{R}: Put a +1/+1 counter on this creature. Activate only if an opponent lost life this turn and only once each turn.",legal,not_legal,https://cards.scryfall.io/normal/front/1/a/1ae41080-0d67-4719-adb2-49bf2a268b6c.jpg?1721426641
Hobbit's Sting,LTR,The Lord of the Rings: Tales of Middle-earth,471,normal,common,1,86784,d8876e00-80c9-4228-b5d2-032b613273b3,0.3,False,False,near_mint,en,USD,Instant,{1}{W},W,W,"Hobbit's Sting deals X damage to target creature, where X is the number of creatures you control plus the number of Foods you control.",legal,legal,https://cards.scryfall.io/normal/front/d/8/d8876e00-80c9-4228-b5d2-032b613273b3.jpg?1695448329
Homunculus Horde,FDN,Foundations,454,normal,rare,1,101348,f3ec1d32-9467-4c79-a9d6-bf3aad2d7fed,1.2,False,False,near_mint,en,USD,Creature — Homunculus,{3}{U},U,U,"Whenever you draw your second card each turn, create a token that's a copy of this creature.",legal,not_legal,https://cards.scryfall.io/normal/front/f/3/f3ec1d32-9467-4c79-a9d6-bf3aad2d7fed.jpg?1730490324
Hopeful Initiate,INR,Innistrad Remastered,27,foil,rare,1,102772,c655f9e8-ff99-48d0-83a9-ea6a853f17c6,0.32,False,False,near_mint,en,USD,Creature — Human Warlock,{W},W,W,"Training (Whenever this creature attacks with another creature with greater power, put a +1/+1 counter on this creature.)
{2}{W}, Remove two +1/+1 counters from among creatures you control: Destroy target artifact or enchantment.",legal,not_legal,https://cards.scryfall.io/normal/front/c/6/c655f9e8-ff99-48d0-83a9-ea6a853f17c6.jpg?1736467517
"Huatli, Poet of Unity // Roar of the Fifth People",LCI,The Lost Caverns of Ixalan,296,normal,mythic,1,88844,b94c8a9e-5b9f-4a80-bced-ee99e5ed060a,0.85,False,False,near_mint,en,USD,Legendary Creature — Human Warrior Bard // Enchantment — Saga,,,"G, R, W",,legal,not_legal,https://cards.scryfall.io/normal/front/b/9/b94c8a9e-5b9f-4a80-bced-ee99e5ed060a.jpg?1699044747
"Hugs, Grisly Guardian",BLB,Bloomburrow,333,normal,mythic,1,95715,94b2be42-467d-4210-b9bf-4d09ee504a22,2.31,False,False,near_mint,en,USD,Legendary Creature — Badger Warrior,{X}{R}{R}{G}{G},"G, R","G, R","Trample
When Hugs enters, exile the top X cards of your library. Until the end of your next turn, you may play those cards.
You may play an additional land on each of your turns.",legal,not_legal,https://cards.scryfall.io/normal/front/9/4/94b2be42-467d-4210-b9bf-4d09ee504a22.jpg?1721427783
Hulldrifter,DFT,Aetherdrift,300,foil,common,1,102886,0279171d-1623-438c-b796-d294c6675604,0.24,False,False,near_mint,en,USD,Artifact — Vehicle,{3}{U}{U},U,U,"Flying
When this Vehicle enters, draw two cards.
Crew 3 (Tap any number of creatures you control with total power 3 or more: This Vehicle becomes an artifact creature until end of turn.)",legal,legal,https://cards.scryfall.io/normal/front/0/2/0279171d-1623-438c-b796-d294c6675604.jpg?1738357128
Hulking Raptor,LCI,The Lost Caverns of Ixalan,327,normal,rare,1,88357,27b95a76-688c-4bd9-a759-f83f1aa18e2a,1.93,False,False,near_mint,en,USD,Creature — Dinosaur,{2}{G}{G},G,G,"Ward {2}
At the beginning of your first main phase, add {G}{G}.",legal,not_legal,https://cards.scryfall.io/normal/front/2/7/27b95a76-688c-4bd9-a759-f83f1aa18e2a.jpg?1699044860
Hunted Nightmare,IKO,Ikoria: Lair of Behemoths,322,normal,rare,1,49755,e8ee8cfc-5d76-4e30-8b53-6ac6c9637d5d,0.49,False,False,near_mint,en,USD,Creature — Nightmare,{1}{B}{B},B,B,"Menace
When this creature enters, target opponent puts a deathtouch counter on a creature they control.",legal,not_legal,https://cards.scryfall.io/normal/front/e/8/e8ee8cfc-5d76-4e30-8b53-6ac6c9637d5d.jpg?1604782188
Huntmaster of the Fells // Ravager of the Fells,INR,Innistrad Remastered,325,normal,rare,1,101875,86da891f-08d0-459c-9d20-358032c6411a,0.4,False,False,near_mint,en,USD,Creature — Human Werewolf // Creature — Werewolf,,,"G, R",,legal,not_legal,https://cards.scryfall.io/normal/front/8/6/86da891f-08d0-459c-9d20-358032c6411a.jpg?1738706096
Hylda's Crown of Winter,WOE,Wilds of Eldraine,247,foil,rare,1,85660,b0d4a6c0-f00e-45a7-9c88-899460007020,0.49,False,False,near_mint,en,USD,Legendary Artifact,{3},,,"{1}, {T}: Tap target creature. This ability costs {1} less to activate during your turn.
{3}, Sacrifice Hylda's Crown of Winter: Draw a card for each tapped creature your opponents control.",legal,not_legal,https://cards.scryfall.io/normal/front/b/0/b0d4a6c0-f00e-45a7-9c88-899460007020.jpg?1692939889
Hylda of the Icy Crown,WOE,Wilds of Eldraine,363,foil,mythic,1,85275,18f5f043-0b59-40ba-bdab-1706adf44075,8.99,False,False,near_mint,en,USD,Legendary Creature — Human Warlock,{2}{W}{U},"U, W","U, W","Whenever you tap an untapped creature an opponent controls, you may pay {1}. When you do, choose one —
• Create a 4/4 white and blue Elemental creature token.
• Put a +1/+1 counter on each creature you control.
• Scry 2, then draw a card.",legal,not_legal,https://cards.scryfall.io/normal/front/1/8/18f5f043-0b59-40ba-bdab-1706adf44075.jpg?1692941074
"Ian Malcolm, Chaotician",REX,Jurassic World Collection,13,foil,rare,1,86332,b4a0402e-e39b-4008-b654-189b4a5e03a3,6.99,False,False,near_mint,en,USD,Legendary Creature — Human Scientist,{1}{U}{R},"R, U","R, U","Whenever a player draws their second card each turn, that player exiles the top card of their library.
During each player's turn, that player may cast a spell from among the cards they don't own exiled with Ian Malcolm, and mana of any type can be spent to cast it.",legal,not_legal,https://cards.scryfall.io/normal/front/b/4/b4a0402e-e39b-4008-b654-189b4a5e03a3.jpg?1698988761
Illusionist's Bracers,RVR,Ravnica Remastered,260,foil,rare,1,89822,9dd8d940-a973-4469-bf78-90318d98f3ab,5.06,False,False,near_mint,en,USD,Artifact — Equipment,{2},,,"Whenever an ability of equipped creature is activated, if it isn't a mana ability, copy that ability. You may choose new targets for the copy.
Equip {3}",legal,not_legal,https://cards.scryfall.io/normal/front/9/d/9dd8d940-a973-4469-bf78-90318d98f3ab.jpg?1702429773
Increasing Vengeance,STA,Strixhaven Mystical Archive,40,normal,mythic,1,58139,6ef32c03-14f5-4ee2-af3a-4cbee45cd152,4.03,False,False,near_mint,en,USD,Instant,{R}{R},R,R,"Copy target instant or sorcery spell you control. If this spell was cast from a graveyard, copy that spell twice instead. You may choose new targets for the copies.
Flashback {3}{R}{R} (You may cast this card from your graveyard for its flashback cost. Then exile it.)",legal,not_legal,https://cards.scryfall.io/normal/front/6/e/6ef32c03-14f5-4ee2-af3a-4cbee45cd152.jpg?1623890316
Indicate,MB2,Mystery Booster 2,501,normal,rare,1,97083,e328353e-d43f-46f7-ab4e-d3e1f3e57c7e,1.49,False,False,near_mint,en,USD,Sorcery,{0},,,Target permanent.,not_legal,not_legal,https://cards.scryfall.io/normal/front/e/3/e328353e-d43f-46f7-ab4e-d3e1f3e57c7e.jpg?1723383483
Indulgent Aristocrat,INR,Innistrad Remastered,384,foil,uncommon,1,102858,fc9ea34e-0a89-42e7-a1b2-575c201a837b,3.04,False,False,near_mint,en,USD,Creature — Vampire Noble,{B},B,B,"Lifelink
{2}, Sacrifice a creature: Put a +1/+1 counter on each Vampire you control.",legal,not_legal,https://cards.scryfall.io/normal/front/f/c/fc9ea34e-0a89-42e7-a1b2-575c201a837b.jpg?1736551754
Inferno Project,C21,Commander 2021,379,normal,rare,1,58880,f6a09368-3fa6-492b-8cfd-8d92113cadca,0.43,False,False,near_mint,en,USD,Creature — Elemental,{6}{R},R,R,"Trample
This creature enters with X +1/+1 counters on it, where X is the total mana value of instant and sorcery cards in your graveyard.",legal,not_legal,https://cards.scryfall.io/normal/front/f/6/f6a09368-3fa6-492b-8cfd-8d92113cadca.jpg?1625983027
Ingenious Mastery,STX,Strixhaven: School of Mages,297,foil,rare,1,58013,18b4f3c5-4129-4e4b-98b9-91d2ca33ab7c,0.7,False,False,near_mint,en,USD,Sorcery,{X}{2}{U},U,U,"You may pay {2}{U} rather than pay this spell's mana cost.
If the {2}{U} cost was paid, you draw three cards, then an opponent creates two Treasure tokens and they scry 2. If that cost wasn't paid, you draw X cards.",legal,not_legal,https://cards.scryfall.io/normal/front/1/8/18b4f3c5-4129-4e4b-98b9-91d2ca33ab7c.jpg?1624741500
Infested Thrinax,M3C,Modern Horizons 3 Commander,74,foil,rare,1,94955,59c6c82f-6b14-4cbe-a11c-26642112d308,0.5,False,False,near_mint,en,USD,Creature — Lizard,{3}{B}{G},"B, G","B, G","Flash
When this creature enters, until end of turn, whenever a nontoken creature you control dies, create a number of 1/1 green Saproling creature tokens equal to that creature's power.",legal,not_legal,https://cards.scryfall.io/normal/front/5/9/59c6c82f-6b14-4cbe-a11c-26642112d308.jpg?1717189972
Innkeeper's Talent,BLB,Bloomburrow,180,foil,rare,1,95954,941b0afc-0e8f-45f2-ae7f-07595e164611,17.3,False,False,near_mint,en,USD,Enchantment — Class,{1}{G},G,G,"(Gain the next level as a sorcery to add its ability.)
At the beginning of combat on your turn, put a +1/+1 counter on target creature you control.
{G}: Level 2
Permanents you control with counters on them have ward {1}.
{3}{G}: Level 3
If you would put one or more counters on a permanent or player, put twice that many of each of those kinds of counters on that permanent or player instead.",legal,not_legal,https://cards.scryfall.io/normal/front/9/4/941b0afc-0e8f-45f2-ae7f-07595e164611.jpg?1721814343
Inquisition of Kozilek,2X2,Double Masters 2022,355,normal,uncommon,1,70246,599cf02f-47a1-47b4-b67e-8f27fa65c151,0.5,False,False,near_mint,en,USD,Sorcery,{B},B,B,Target player reveals their hand. You choose a nonland card from it with mana value 3 or less. That player discards that card.,legal,not_legal,https://cards.scryfall.io/normal/front/5/9/599cf02f-47a1-47b4-b67e-8f27fa65c151.jpg?1674097255
Inspiring Overseer,SLD,Secret Lair Drop,1523,foil,rare,2,92924,4f5b136d-34ad-4bf4-bb1b-1523df01f441,6.98,False,False,near_mint,en,USD,Creature — Angel Cleric,{2}{W},W,W,"Flying
When this creature enters, you gain 1 life and draw a card.",legal,legal,https://cards.scryfall.io/normal/front/4/f/4f5b136d-34ad-4bf4-bb1b-1523df01f441.jpg?1739789063
Inspiring Refrain,C21,Commander 2021,354,normal,rare,1,58882,fa083791-6c1b-4165-b0bc-393cc369503a,1.0,False,False,near_mint,en,USD,Sorcery,{4}{U}{U},U,U,"Draw two cards. Exile Inspiring Refrain with three time counters on it.
Suspend 3—{2}{U} (Rather than cast this card from your hand, you may pay {2}{U} and exile it with three time counters on it. At the beginning of your upkeep, remove a time counter. When the last is removed, you may cast it without paying its mana cost.)",legal,not_legal,https://cards.scryfall.io/normal/front/f/a/fa083791-6c1b-4165-b0bc-393cc369503a.jpg?1625982205
Inspiring Vantage,OTJ,Outlaws of Thunder Junction,269,normal,rare,1,93242,85df6b6a-2dcf-4828-a4a8-e07d52e1fddd,3.43,False,False,near_mint,en,USD,Land,,,"R, W","This land enters tapped unless you control two or fewer other lands.
{T}: Add {R} or {W}.",legal,not_legal,https://cards.scryfall.io/normal/front/8/5/85df6b6a-2dcf-4828-a4a8-e07d52e1fddd.jpg?1723149865
