Name,Set code,Set name,Collector number,Foil,Rarity,Language,Quantity,Purchase price,Purchase price currency,Scryfall ID,ManaBox ID,Misprint,Altered,Condition,Type,Mana Cost,Colors,Color Identity,Oracle Text,Commander Legal,Pauper Legal,CMC,Image URL
Savage Order,rex,Jurassic World Collection,6,normal,rare,en,1,0.0,USD,f571ef55-50dd-4624-aa42-fea5a0303033,,False,False,near_mint,Sorcery,{2}{G}{G},G,G,"As an additional cost to cast this spell, sacrifice a creature with power 4 or greater.
Search your library for a Dinosaur creature card, put it onto the battlefield, then shuffle. It gains indestructible until your next turn.",legal,not_legal,4.0,https://cards.scryfall.io/normal/front/f/5/f571ef55-50dd-4624-aa42-fea5a0303033.jpg?1698988745
Savior of Ollenbock,dbl,Innistrad: Double Feature,301,normal,mythic,en,1,0.0,USD,d1867911-938e-4787-9c0f-9273ccb61247,,False,False,near_mint,Creature — Human Soldier,{1}{W}{W},W,W,"Training (Whenever this creature attacks with another creature with greater power, put a +1/+1 counter on this creature.)
Whenever this creature trains, exile up to one other target creature from the battlefield or creature card from a graveyard.
When this creature leaves the battlefield, put the exiled cards onto the battlefield under their owners' control.",legal,not_legal,3.0,https://cards.scryfall.io/normal/front/d/1/d1867911-938e-4787-9c0f-9273ccb61247.jpg?1673161616
Scavenging Ooze,fdn,Foundations,232,normal,rare,en,1,0.0,USD,8c504c23-1e9a-411b-9cfe-4180d0c744f6,,False,False,near_mint,Creature — Ooze,{1}{G},G,G,"{G}: Exile target card from a graveyard. If it was a creature card, put a +1/+1 counter on this creature and you gain 1 life.",legal,not_legal,2.0,https://cards.scryfall.io/normal/front/8/c/8c504c23-1e9a-411b-9cfe-4180d0c744f6.jpg?1730489464
Scion of Calamity,lcc,The Lost Caverns of Ixalan Commander,61,normal,rare,en,1,0.0,USD,bb231f52-cab4-44e9-8804-22436817df06,,False,False,near_mint,Creature — Dinosaur,{3}{G}{G},G,G,"Myriad (Whenever this creature attacks, for each opponent other than defending player, you may create a token copy that's tapped and attacking that player or a planeswalker they control. Exile the tokens at end of combat.)
Whenever this creature deals combat damage to a player, destroy target artifact or enchantment that player controls.",legal,not_legal,5.0,https://cards.scryfall.io/normal/front/b/b/bb231f52-cab4-44e9-8804-22436817df06.jpg?1698987915
Scrawling Crawler,fdn,Foundations,354,normal,rare,en,1,0.0,USD,14d8c9b5-6863-45d1-89f0-6a4f8189758b,,False,False,near_mint,Artifact Creature — Phyrexian Construct,{3},,,"At the beginning of your upkeep, each player draws a card.
Whenever an opponent draws a card, that player loses 1 life.",legal,not_legal,3.0,https://cards.scryfall.io/normal/front/1/4/14d8c9b5-6863-45d1-89f0-6a4f8189758b.jpg?1730489928
Scrawling Crawler,fdn,Foundations,354,normal,rare,en,2,0.0,USD,14d8c9b5-6863-45d1-89f0-6a4f8189758b,,False,False,near_mint,Artifact Creature — Phyrexian Construct,{3},,,"At the beginning of your upkeep, each player draws a card.
Whenever an opponent draws a card, that player loses 1 life.",legal,not_legal,3.0,https://cards.scryfall.io/normal/front/1/4/14d8c9b5-6863-45d1-89f0-6a4f8189758b.jpg?1730489928
Screaming Nemesis,dsk,Duskmourn: House of Horror,157,normal,mythic,en,1,0.0,USD,ce35e6fb-ff54-44c4-a216-7ddd37f46882,,False,False,near_mint,Creature — Spirit,{2}{R},R,R,"Haste
Whenever this creature is dealt damage, it deals that much damage to any other target. If a player is dealt damage this way, they can't gain life for the rest of the game.",legal,not_legal,3.0,https://cards.scryfall.io/normal/front/c/e/ce35e6fb-ff54-44c4-a216-7ddd37f46882.jpg?1726286439
Tarmogoyf,pip,Fallout,349,normal,mythic,en,1,0.0,USD,4d514db4-cf57-4442-a7c9-7373a2a42c0d,,False,False,near_mint,Creature — Lhurgoyf,{1}{G},G,G,Tarmogoyf's power is equal to the number of card types among cards in all graveyards and its toughness is equal to that number plus 1.,legal,not_legal,2.0,https://cards.scryfall.io/normal/front/4/d/4d514db4-cf57-4442-a7c9-7373a2a42c0d.jpg?1708743615
Searslicer Goblin,fdn,Foundations,468,normal,rare,en,1,0.0,USD,9e3059e4-b198-4eba-98e8-f0f9f83d1928,,False,False,near_mint,Creature — Goblin Warrior,{1}{R},R,R,"Raid — At the beginning of your end step, if you attacked this turn, create a 1/1 red Goblin creature token.",legal,not_legal,2.0,https://cards.scryfall.io/normal/front/9/e/9e3059e4-b198-4eba-98e8-f0f9f83d1928.jpg?1730490378
Season of Gathering,blb,Bloomburrow,286,normal,mythic,en,1,0.0,USD,6e99fa55-2594-434b-9396-95b8f661bd0d,,False,False,near_mint,Sorcery,{4}{G}{G},G,G,"Choose up to five {P} worth of modes. You may choose the same mode more than once.
{P} — Put a +1/+1 counter on a creature you control. It gains vigilance and trample until end of turn.
{P}{P} — Choose artifact or enchantment. Destroy all permanents of the chosen type.
{P}{P}{P} — Draw cards equal to the greatest power among creatures you control.",legal,not_legal,6.0,https://cards.scryfall.io/normal/front/6/e/6e99fa55-2594-434b-9396-95b8f661bd0d.jpg?1721427519
Second Harvest,inr,Innistrad Remastered,417,normal,rare,en,1,0.0,USD,a1ed6d4f-9c1b-4007-899a-e2209996dd0d,,False,False,near_mint,Instant,{2}{G}{G},G,G,"For each token you control, create a token that's a copy of that permanent.",legal,not_legal,4.0,https://cards.scryfall.io/normal/front/a/1/a1ed6d4f-9c1b-4007-899a-e2209996dd0d.jpg?1736551524
Sedgemoor Witch,plst,The List,STX-86,normal,rare,en,1,0.0,USD,f4b23f65-3c5a-4911-bf08-dcfc5e844832,,False,False,near_mint,Creature — Human Warlock,{2}{B},B,B,"Menace
Ward—Pay 3 life. (Whenever this creature becomes the target of a spell or ability an opponent controls, counter it unless that player pays 3 life.)
Magecraft — Whenever you cast or copy an instant or sorcery spell, create a 1/1 black and green Pest creature token with ""When this token dies, you gain 1 life.""",legal,not_legal,3.0,https://cards.scryfall.io/normal/front/f/4/f4b23f65-3c5a-4911-bf08-dcfc5e844832.jpg?1723443335
"Selvala, Heart of the Wilds",cmm,Commander Masters,320,normal,mythic,en,1,0.0,USD,7d711cb2-4f34-4792-90d7-2be5d329a347,,False,False,near_mint,Legendary Creature — Elf Scout,{1}{G}{G},G,G,"Whenever another creature enters, its controller may draw a card if its power is greater than each other creature's power.
{G}, {T}: Add X mana in any combination of colors, where X is the greatest power among creatures you control.",legal,not_legal,3.0,https://cards.scryfall.io/normal/front/7/d/7d711cb2-4f34-4792-90d7-2be5d329a347.jpg?1689998846
Sengir Nosferatu,tsr,Time Spiral Remastered,136,normal,rare,en,2,0.0,USD,71dc9f1e-b889-402d-a5a1-fa0d7d493246,,False,False,near_mint,Creature — Vampire,{3}{B}{B},B,B,"Flying
{1}{B}, Exile this creature: Create a 1/2 black Bat creature token with flying. It has ""{1}{B}, Sacrifice this token: Return an exiled card named Sengir Nosferatu to the battlefield under its owner's control.""",legal,not_legal,5.0,https://cards.scryfall.io/normal/front/7/1/71dc9f1e-b889-402d-a5a1-fa0d7d493246.jpg?1619396036
Sentinel of Lost Lore,woe,Wilds of Eldraine,358,normal,rare,en,1,0.0,USD,a8556d3c-9290-4600-afa5-5928d74e3c96,,False,False,near_mint,Creature — Elf Knight,{1}{G}{G},G,G,"When this creature enters, choose one or more —
• Return target card you own in exile that has an Adventure to your hand.
• Put target card you don't own in exile that has an Adventure on the bottom of its owner's library.
• Exile target player's graveyard.",legal,not_legal,3.0,https://cards.scryfall.io/normal/front/a/8/a8556d3c-9290-4600-afa5-5928d74e3c96.jpg?1692941022
Sentinel of the Nameless City,lci,The Lost Caverns of Ixalan,383,normal,rare,en,1,0.0,USD,f0563531-ccd5-4dc4-88dd-a1e438507cba,,False,False,near_mint,Creature — Merfolk Warrior Scout,{2}{G},G,G,"Vigilance
Whenever this creature enters or attacks, create a Map token. (It's an artifact with ""{1}, {T}, Sacrifice this token: Target creature you control explores. Activate only as a sorcery."")",legal,not_legal,3.0,https://cards.scryfall.io/normal/front/f/0/f0563531-ccd5-4dc4-88dd-a1e438507cba.jpg?1699045047
"Senu, Keen-Eyed Protector",acr,Assassin's Creed,8,normal,rare,en,1,0.0,USD,5671a03d-0858-41e7-976c-60825c29af04,,False,False,near_mint,Legendary Creature — Bird Scout,{1}{W},W,W,"Flying, vigilance
{T}, Exile Senu: You gain 2 life and scry 2.
When a legendary creature you control attacks and isn't blocked, if this card is exiled, put it onto the battlefield attacking.",legal,not_legal,2.0,https://cards.scryfall.io/normal/front/5/6/5671a03d-0858-41e7-976c-60825c29af04.jpg?1721423622
Serpent of Yawning Depths,thb,Theros Beyond Death,291,normal,rare,en,1,0.0,USD,a4ac18ae-0d1e-43f5-9cc9-722fa6e36fe5,,False,False,near_mint,Enchantment Creature — Serpent,{4}{U}{U},U,U,"Krakens, Leviathans, Octopuses, and Serpents you control can't be blocked except by Krakens, Leviathans, Octopuses, and Serpents.",legal,not_legal,6.0,https://cards.scryfall.io/normal/front/a/4/a4ac18ae-0d1e-43f5-9cc9-722fa6e36fe5.jpg?1580181703
Serra Avenger,tsr,Time Spiral Remastered,41,normal,rare,en,1,0.0,USD,8e5627de-fda7-4e39-a6ec-1e895bc353ed,,False,False,near_mint,Creature — Angel,{W}{W},W,W,"You can't cast Serra Avenger during your first, second, or third turns of the game.
Flying, vigilance",legal,not_legal,2.0,https://cards.scryfall.io/normal/front/8/e/8e5627de-fda7-4e39-a6ec-1e895bc353ed.jpg?1620236195
Shadowborn Demon,j22,Jumpstart 2022,464,normal,mythic,en,1,0.0,USD,f0410803-7337-4537-bcae-e677014640d4,,False,False,near_mint,Creature — Demon,{3}{B}{B},B,B,"Flying
When this creature enters, destroy target non-Demon creature.
At the beginning of your upkeep, if there are fewer than six creature cards in your graveyard, sacrifice a creature.",legal,not_legal,5.0,https://cards.scryfall.io/normal/front/f/0/f0410803-7337-4537-bcae-e677014640d4.jpg?1675649865
"Shaile, Dean of Radiance // Embrose, Dean of Shadow",stx,Strixhaven: School of Mages,330,normal,rare,en,1,0.0,USD,c18ebfe1-f953-4aa3-933e-eee58fc4a0dd,,False,False,near_mint,Legendary Creature — Bird Cleric // Legendary Creature — Human Warlock,,,"B, W",,legal,not_legal,2.0,https://cards.scryfall.io/normal/front/c/1/c18ebfe1-f953-4aa3-933e-eee58fc4a0dd.jpg?1630176718
Sharp-Eyed Rookie,mkm,Murders at Karlov Manor,176,normal,rare,en,1,0.0,USD,3d5d4788-a970-4e09-89a1-740eca9331d9,,False,False,near_mint,Creature — Human Detective,{1}{G},G,G,"Vigilance
Whenever a creature you control enters, if its power is greater than this creature's power or its toughness is greater than this creature's toughness, put a +1/+1 counter on this creature and investigate. (Create a Clue token. It's an artifact with ""{2}, Sacrifice this token: Draw a card."")",legal,not_legal,2.0,https://cards.scryfall.io/normal/front/3/d/3d5d4788-a970-4e09-89a1-740eca9331d9.jpg?1706242085
Show and Tell,mb2,Mystery Booster 2,171,normal,mythic,en,1,0.0,USD,9858463e-0b80-44a2-80d5-e4250809e1f5,,False,False,near_mint,Sorcery,{2}{U},U,U,"Each player may put an artifact, creature, enchantment, or land card from their hand onto the battlefield.",legal,not_legal,3.0,https://cards.scryfall.io/normal/front/9/8/9858463e-0b80-44a2-80d5-e4250809e1f5.jpg?1723221489
Showdown of the Skalds,khm,Kaldheim,229,normal,rare,en,1,0.0,USD,3d9d840e-1f13-44e3-a4de-903cfa58a346,,False,False,near_mint,Enchantment — Saga,{2}{R}{W},"R, W","R, W","(As this Saga enters and after your draw step, add a lore counter. Sacrifice after III.)
I — Exile the top four cards of your library. Until the end of your next turn, you may play those cards.
II, III — Whenever you cast a spell this turn, put a +1/+1 counter on target creature you control.",legal,not_legal,4.0,https://cards.scryfall.io/normal/front/3/d/3d9d840e-1f13-44e3-a4de-903cfa58a346.jpg?1631051876
Sigarda's Splendor,mid,Innistrad: Midnight Hunt,33,normal,rare,en,1,0.0,USD,bb22626d-84ef-40d1-a4f2-771b45198eaa,,False,False,near_mint,Enchantment,{2}{W}{W},W,W,"As this enchantment enters, note your life total.
At the beginning of your upkeep, draw a card if your life total is greater than or equal to the last noted life total for this enchantment. Then note your life total.
Whenever you cast a white spell, you gain 1 life.",legal,not_legal,4.0,https://cards.scryfall.io/normal/front/b/b/bb22626d-84ef-40d1-a4f2-771b45198eaa.jpg?1634348440
Silent Clearing,acr,Assassin's Creed,115,normal,rare,en,1,0.0,USD,0de40ccf-5db9-4e4f-b61b-8fc4454209ae,,False,False,near_mint,Land,,,"B, W","{T}, Pay 1 life: Add {W} or {B}.
{1}, {T}, Sacrifice this land: Draw a card.",legal,not_legal,0.0,https://cards.scryfall.io/normal/front/0/d/0de40ccf-5db9-4e4f-b61b-8fc4454209ae.jpg?1735993476
Silent Hallcreeper,dsk,Duskmourn: House of Horror,72,normal,rare,en,1,0.0,USD,aac4f0cc-63be-4f08-956e-39839c9735ba,,False,False,near_mint,Enchantment Creature — Horror,{1}{U},U,U,"This creature can't be blocked.
Whenever this creature deals combat damage to a player, choose one that hasn't been chosen —
• Put two +1/+1 counters on this creature.
• Draw a card.
• This creature becomes a copy of another target creature you control.",legal,not_legal,2.0,https://cards.scryfall.io/normal/front/a/a/aac4f0cc-63be-4f08-956e-39839c9735ba.jpg?1726286122
Silver Scrutiny,dmu,Dominaria United,65,normal,rare,en,1,0.0,USD,8b650ab6-9c22-424f-99e5-8ef5235a18a3,,False,False,near_mint,Sorcery,{X}{U}{U},U,U,"You may cast this spell as though it had flash if X is 3 or less.
Draw X cards.",legal,not_legal,2.0,https://cards.scryfall.io/normal/front/8/b/8b650ab6-9c22-424f-99e5-8ef5235a18a3.jpg?1673306845
Simulacrum Synthesizer,big,The Big Score,6,normal,mythic,en,1,0.0,USD,aaa05ad1-5cda-4edd-b6bf-562ae3e5011a,,False,False,near_mint,Artifact,{2}{U},U,U,"When this artifact enters, scry 2.
Whenever another artifact you control with mana value 3 or greater enters, create a 0/0 colorless Construct artifact creature token with ""This token gets +1/+1 for each artifact you control.""",legal,not_legal,3.0,https://cards.scryfall.io/normal/front/a/a/aaa05ad1-5cda-4edd-b6bf-562ae3e5011a.jpg?1739804163
Siphon Insight,otp,Breaking News,54,normal,rare,en,2,0.0,USD,07fb25f7-1fb7-4c2a-abb8-adfb24860bce,,False,False,near_mint,Instant,{U}{B},"B, U","B, U","Look at the top two cards of target opponent's library. Exile one of them face down and put the other on the bottom of that library. You may play the exiled card for as long as it remains exiled, and you may spend mana as though it were mana of any color to cast that spell.
Flashback {1}{U}{B}",legal,not_legal,2.0,https://cards.scryfall.io/normal/front/0/7/07fb25f7-1fb7-4c2a-abb8-adfb24860bce.jpg?1712353618
Skeleton Crew,lcc,The Lost Caverns of Ixalan Commander,53,normal,rare,en,1,0.0,USD,ff4c0391-6411-4f28-93ae-5390531c3e6c,,False,False,near_mint,Creature — Skeleton Pirate,{3}{B},B,B,"Each other creature you control that's a Skeleton or Pirate gets +1/+1.
Whenever one or more creature cards leave your graveyard, create a 2/2 black Skeleton Pirate creature token. (This ability triggers only from the battlefield.)
{5}{B}: Return this card from your graveyard to the battlefield tapped.",legal,not_legal,4.0,https://cards.scryfall.io/normal/front/f/f/ff4c0391-6411-4f28-93ae-5390531c3e6c.jpg?1700657241
Skittering Cicada,cmm,Commander Masters,750,normal,rare,en,1,0.0,USD,4a430137-70d9-45fc-acaa-87b29ea0d588,,False,False,near_mint,Creature — Insect,{3},,,"Flash
You may cast colorless spells as though they had flash.
Whenever you cast a colorless spell, until end of turn, this creature gains trample and gets +X/+X, where X is that spell's mana value.",legal,not_legal,3.0,https://cards.scryfall.io/normal/front/4/a/4a430137-70d9-45fc-acaa-87b29ea0d588.jpg?1690003338
Skybox Ferry,dft,Aetherdrift,332,normal,common,en,1,0.0,USD,cd9e294e-cdb2-423d-a034-f68f673b5973,,False,False,near_mint,Artifact — Vehicle,{5},,,"Flying
Crew 2 (Tap any number of creatures you control with total power 2 or more: This Vehicle becomes an artifact creature until end of turn.)
Cycling {2} ({2}, Discard this card: Draw a card.)",legal,legal,5.0,https://cards.scryfall.io/normal/front/c/d/cd9e294e-cdb2-423d-a034-f68f673b5973.jpg?1738357289
Skyclave Apparition,mb2,Mystery Booster 2,18,normal,rare,en,1,0.0,USD,32d7ddec-4d14-4a4c-b1cf-092999347498,,False,False,near_mint,Creature — Kor Spirit,{1}{W}{W},W,W,"When this creature enters, exile up to one target nonland, nontoken permanent you don't control with mana value 4 or less.
When this creature leaves the battlefield, the exiled card's owner creates an X/X blue Illusion creature token, where X is the mana value of the exiled card.",legal,not_legal,3.0,https://cards.scryfall.io/normal/front/3/2/32d7ddec-4d14-4a4c-b1cf-092999347498.jpg?1723226435
Skyseer's Chariot,dft,Aetherdrift,296,normal,rare,en,1,0.0,USD,ec0eb86e-371c-46fd-a261-384b2a603b36,,False,False,near_mint,Artifact — Vehicle,{1}{W},W,W,"Flying
As this Vehicle enters, choose a nonland card name.
Activated abilities of sources with the chosen name cost {2} more to activate.
Crew 2",legal,not_legal,2.0,https://cards.scryfall.io/normal/front/e/c/ec0eb86e-371c-46fd-a261-384b2a603b36.jpg?1738357104
Slagstorm,fdn,Foundations,207,normal,rare,en,1,0.0,USD,9db2e3a9-b90d-44cd-a2bd-eeb7dbe255b0,,False,False,near_mint,Sorcery,{1}{R}{R},R,R,"Choose one —
• Slagstorm deals 3 damage to each creature.
• Slagstorm deals 3 damage to each player.",legal,not_legal,3.0,https://cards.scryfall.io/normal/front/9/d/9db2e3a9-b90d-44cd-a2bd-eeb7dbe255b0.jpg?1730489366
Skyseer's Chariot,dft,Aetherdrift,296,normal,rare,en,1,0.0,USD,ec0eb86e-371c-46fd-a261-384b2a603b36,,False,False,near_mint,Artifact — Vehicle,{1}{W},W,W,"Flying
As this Vehicle enters, choose a nonland card name.
Activated abilities of sources with the chosen name cost {2} more to activate.
Crew 2",legal,not_legal,2.0,https://cards.scryfall.io/normal/front/e/c/ec0eb86e-371c-46fd-a261-384b2a603b36.jpg?1738357104
Slaughter Pact,tsr,Time Spiral Remastered,138,normal,rare,en,2,0.0,USD,81e00341-030f-433e-b22b-aca42e0a88d2,,False,False,near_mint,Instant,{0},B,B,"Destroy target nonblack creature.
At the beginning of your next upkeep, pay {2}{B}. If you don't, you lose the game.",legal,not_legal,0.0,https://cards.scryfall.io/normal/front/8/1/81e00341-030f-433e-b22b-aca42e0a88d2.jpg?1619396090
Slaughter Specialist,dbl,Innistrad: Double Feature,122,normal,rare,en,1,0.0,USD,18386c30-b2c1-41b4-a3a6-90493d1c9c2d,,False,False,near_mint,Creature — Vampire Warrior,{1}{B},B,B,"When this creature enters, each opponent creates a 1/1 white Human creature token.
Whenever a creature an opponent controls dies, put a +1/+1 counter on this creature.",legal,not_legal,2.0,https://cards.scryfall.io/normal/front/1/8/18386c30-b2c1-41b4-a3a6-90493d1c9c2d.jpg?1673159762
"Slimefoot, the Stowaway",tsr,Time Spiral Remastered,386,normal,special,en,1,0.0,USD,7e4d684a-2de8-477c-a4d5-d7ae80d62318,,False,False,near_mint,Legendary Creature — Fungus,{1}{B}{G},"B, G","B, G","Whenever a Saproling you control dies, Slimefoot deals 1 damage to each opponent and you gain 1 life.
{4}: Create a 1/1 green Saproling creature token.",legal,not_legal,3.0,https://cards.scryfall.io/normal/front/7/e/7e4d684a-2de8-477c-a4d5-d7ae80d62318.jpg?1619402757
Snakeskin Veil,sta,Strixhaven Mystical Archive,57,normal,uncommon,en,1,0.0,USD,d9849b22-1fba-4f6a-bd94-df1bc1764e6b,,False,False,near_mint,Instant,{G},G,G,Put a +1/+1 counter on target creature you control. It gains hexproof until end of turn. (It can't be the target of spells or abilities your opponents control.),legal,legal,1.0,https://cards.scryfall.io/normal/front/d/9/d9849b22-1fba-4f6a-bd94-df1bc1764e6b.jpg?1624065596
Snow-Covered Island,mb2,Mystery Booster 2,117,normal,common,en,1,0.0,USD,16eb4c0a-962a-4df9-8101-a6baabfa80db,,False,False,near_mint,Basic Snow Land — Island,,,U,({T}: Add {U}.),legal,legal,0.0,https://cards.scryfall.io/normal/front/1/6/16eb4c0a-962a-4df9-8101-a6baabfa80db.jpg?1723228313
Snow-Covered Plains,mb2,Mystery Booster 2,116,normal,common,en,1,0.0,USD,8f6a631b-e3e7-4647-825e-c0b6aeff76df,,False,False,near_mint,Basic Snow Land — Plains,,,W,({T}: Add {W}.),legal,legal,0.0,https://cards.scryfall.io/normal/front/8/f/8f6a631b-e3e7-4647-825e-c0b6aeff76df.jpg?1723229005
Snuff Out,mb2,Mystery Booster 2,187,normal,common,en,1,0.0,USD,1de0e766-9246-413e-884c-af1826857547,,False,False,near_mint,Instant,{3}{B},B,B,"If you control a Swamp, you may pay 4 life rather than pay this spell's mana cost.
Destroy target nonblack creature. It can't be regenerated.",legal,legal,4.0,https://cards.scryfall.io/normal/front/1/d/1de0e766-9246-413e-884c-af1826857547.jpg?1723222337
Sole Performer,unf,Unfinity,154,normal,rare,en,1,0.0,USD,e65e8d13-10b1-4d0b-813f-c45058560e5c,,False,False,near_mint,Creature — Elf Performer,{2}{G}{G},G,G,"{T}: Add {T}{T}. Activate only once each turn. (While activating an ability, use {T} rather than tapping the permanent to pay for {T}.)",not_legal,not_legal,4.0,https://cards.scryfall.io/normal/front/e/6/e65e8d13-10b1-4d0b-813f-c45058560e5c.jpg?1698002640
"Sorin, Imperious Bloodlord",inr,Innistrad Remastered,133,normal,mythic,en,1,0.0,USD,219d3e48-e0b1-472d-ac45-11c14b292c9e,,False,False,near_mint,Legendary Planeswalker — Sorin,{2}{B},B,B,"+1: Target creature you control gains deathtouch and lifelink until end of turn. If it's a Vampire, put a +1/+1 counter on it.
+1: You may sacrifice a Vampire. When you do, Sorin deals 3 damage to any target and you gain 3 life.
−3: You may put a Vampire creature card from your hand onto the battlefield.",legal,not_legal,3.0,https://cards.scryfall.io/normal/front/2/1/219d3e48-e0b1-472d-ac45-11c14b292c9e.jpg?1736468052
Soul-Guide Gryff,dbl,Innistrad: Double Feature,35,normal,common,en,1,0.0,USD,d4ef842d-9898-49d5-a6f6-a032c23f2ee5,,False,False,near_mint,Creature — Hippogriff Spirit,{4}{W},W,W,"Flying
When this creature enters, exile up to one target card from a graveyard.",legal,legal,5.0,https://cards.scryfall.io/normal/front/d/4/d4ef842d-9898-49d5-a6f6-a032c23f2ee5.jpg?1673158843
Souls of the Lost,lci,The Lost Caverns of Ixalan,369,normal,rare,en,1,0.0,USD,efc2f3d3-6bac-4ca7-9c42-badf649269f5,,False,False,near_mint,Creature — Spirit,{1}{B},B,B,"As an additional cost to cast this spell, discard a card or sacrifice a permanent.
Fathomless descent — Souls of the Lost's power is equal to the number of permanent cards in your graveyard and its toughness is equal to that number plus 1.",legal,not_legal,2.0,https://cards.scryfall.io/normal/front/e/f/efc2f3d3-6bac-4ca7-9c42-badf649269f5.jpg?1699044995
Soulstone Sanctuary,fdn,Foundations,356,normal,rare,en,1,0.0,USD,98f4cc78-c25f-494c-b57e-c185d37605e8,,False,False,near_mint,Land,,,,"{T}: Add {C}.
{4}: This land becomes a 3/3 creature with vigilance and all creature types. It's still a land.",legal,not_legal,0.0,https://cards.scryfall.io/normal/front/9/8/98f4cc78-c25f-494c-b57e-c185d37605e8.jpg?1730489935
Souvenir T-Shirt,unf,Unfinity,192,normal,rare,en,1,0.0,USD,267c468d-7faa-43f9-8221-1640c76403b9,,False,False,near_mint,Artifact — Equipment,{3},,,"Gear Up, sponsored by Wizards of the Coast — As this Equipment enters, roll two six-sided dice. For each Magic-branded item you're wearing, roll an additional six-sided die. Choose two of those results.
Equipped creature gets +X/+Y, where X is the first chosen result and Y is the second.
Equip {4}",not_legal,not_legal,3.0,https://cards.scryfall.io/normal/front/2/6/267c468d-7faa-43f9-8221-1640c76403b9.jpg?1673915103
Sowing Mycospawn,mh3,Modern Horizons 3,340,normal,rare,en,1,0.0,USD,f511bfe7-b107-4ec5-b363-f718c19d9579,,False,False,near_mint,Creature — Eldrazi Fungus,{3}{G},,G,"Devoid (This card has no color.)
Kicker {1}{C} (You may pay an additional {1}{C} as you cast this spell.)
When you cast this spell, search your library for a land card, put it onto the battlefield, then shuffle.
When you cast this spell, if it was kicked, exile target land.",legal,not_legal,4.0,https://cards.scryfall.io/normal/front/f/5/f511bfe7-b107-4ec5-b363-f718c19d9579.jpg?1740308402
Spectator Seating,cmm,Commander Masters,427,normal,rare,en,1,0.0,USD,dcf3140f-d5c8-45ff-8be4-622b1a129b3d,,False,False,near_mint,Land,,,"R, W","This land enters tapped unless you have two or more opponents.
{T}: Add {R} or {W}.",legal,not_legal,0.0,https://cards.scryfall.io/normal/front/d/c/dcf3140f-d5c8-45ff-8be4-622b1a129b3d.jpg?1689999977
Spectator Seating,cmr,Commander Legends,356,normal,rare,en,1,0.0,USD,2f6f1453-fe93-4a29-965c-5f867a81e8b3,,False,False,near_mint,Land,,,"R, W","This land enters tapped unless you have two or more opponents.
{T}: Add {R} or {W}.",legal,not_legal,0.0,https://cards.scryfall.io/normal/front/2/f/2f6f1453-fe93-4a29-965c-5f867a81e8b3.jpg?1608911848
Spectator Seating,cmr,Commander Legends,356,normal,rare,en,1,0.0,USD,2f6f1453-fe93-4a29-965c-5f867a81e8b3,,False,False,near_mint,Land,,,"R, W","This land enters tapped unless you have two or more opponents.
{T}: Add {R} or {W}.",legal,not_legal,0.0,https://cards.scryfall.io/normal/front/2/f/2f6f1453-fe93-4a29-965c-5f867a81e8b3.jpg?1608911848
Spectral Shepherd,inr,Innistrad Remastered,349,normal,uncommon,en,1,0.0,USD,89fd38be-8b2a-4ff4-8f51-e7d6971f7aef,,False,False,near_mint,Creature — Spirit,{2}{W},W,"U, W","Flying
{1}{U}: Return target Spirit you control to its owner's hand.",legal,not_legal,3.0,https://cards.scryfall.io/normal/front/8/9/89fd38be-8b2a-4ff4-8f51-e7d6971f7aef.jpg?1736551459
